{
  "version": 1,
  "runtimeImage": "docker.io/library/anxious-s13-issue16-runtime@sha256:3c3cb4f515a2053cf26c9bd0fb3567f2d666cecb2b8b013866c1247ef8394690",
  "runnerImage": "docker.io/library/anxious-s13-issue16-runner@sha256:e8b91b0c4291c2412f5ad58796034e01931d8b2a120a0a21ec7f9b40ea2454de",
  "provisionerImageId": "sha256:65113675ba9e1d067a2213127157bcabece62e47254c8d9987abcff4c088e108",
  "api": "https://kubernetes.default.svc:443",
  "hostApi": "https://localhost:6443",
  "namespaceUid": "415c3924-8092-4c62-9ddf-846b5185a7bd",
  "podCIDR": "10.42.0.0/16",
  "node": "anxious-lookout",
  "nodeUid": "1ece1b22-734e-4575-b35f-8e7ae0ca5f9b",
  "bootId": "e90e21db-5eca-4f3f-8c8e-47b25198cadb",
  "hostPidNamespace": "pid:[4026531836]",
  "hostCgroupNamespace": "cgroup:[4026531835]",
  "providerAccountId": "REPLACE_WITH_REVIEWED_PROVIDER_ACCOUNT",
  "sourceUid": 1000,
  "allowlist": ["ff4b718f-de46-4c10-9195-c993eff9ded9"],
  "kubectl": "/var/lib/rancher/k3s/data/d83b1e679e41e04bbf4c6ff76f5684f0f98b2b4bf29bb632db4a497cd8093a71/bin/k3s",
  "crictl": "/var/lib/rancher/k3s/data/d83b1e679e41e04bbf4c6ff76f5684f0f98b2b4bf29bb632db4a497cd8093a71/bin/k3s",
  "criSocket": "/run/k3s/containerd/containerd.sock",
  "maxPods": 3,
  "idleSeconds": 1800,
  "nativeSizeGiB": 5,
  "controlSizeGiB": 1
}
